Order,Rank,FirstName,MiddleName,LastName,Suffix,Degree,Email,Orcid,Corresponding,EqualContribution,Contribution,Acknowledgement,Conflict,Affiliation1,Affiliation2,Affiliation3,Affiliation4
1,1,Zhipeng,,Cao,,PhD,zhipeng.cao@neuroverse.lab,0000-0001-1111-1111,TRUE,none,"Neuroimaging wizardry; Pipeline wrangling; Wrote the first draft while coffee was still hot","Thanks to the MRI machine for behaving (mostly)","No conflict, unless rivalry with the autocorrect counts","Shanghai Xuhui Mental Health Center, Shanghai, China","Quantum Brain Lab, Lunar Base","Interstellar Data Commons",
2,1,John,,Snow,,MD,john.snow@winterfell.north,0000-0002-2222-2222,TRUE,co-senior,"Kept the cohort organized beyond the wall; Field-tested cold-resistant protocols","Acknowledges the Night's Watch for late-night data collection","Conflict: sworn oath to scientific neutrality","Winterfell Institute of Cognitive Resilience","Interstellar Data Commons","Northern Clinical Alliance",
3,2,Harry,,Potter,,PhD,harry.potter@hogwarts.owl,0000-0003-3333-3333,FALSE,co-senior,"Magic-to-metric translation; Patronus-level visualization","Thanks to a helpful owl for delivery of IRB forms","Conflict: occasional wand-related artifacts","Hogwarts School of Mind and Magic","Quantum Brain Lab, Lunar Base","Ministry of Magic Research Unit",
4,3,Neo,,Anderson,,PhD,neo.matrix@zion.free,0000-0004-4444-4444,TRUE,none,"Reality-bending visualization; Debugged the simulation mid-scan","Thanks to the red pill for improving contrast","Conflict: occasional mismatch with system administrators","Zion Institute for Systems Neuroscience","Matrix Simulation Lab","Interstellar Data Commons",
5,2,Dolores,,Abernathy,,PhD,dolores@westworld.loop,0000-0005-5555-5555,FALSE,none,"Human-robot interface insights; Memory loop analysis","Acknowledges the host maintenance team for stable uptime","Conflict: philosophical debates with the control room","Westworld Neural Dynamics Lab","Host Cognition Unit","Quantum Brain Lab, Lunar Base",
6,3,Sheldon,,Cooper,,PhD,sheldon.cooper@caltech.quark,0000-0006-6666-6666,TRUE,none,"Theoretical framing; Statistical rigor; Fun with p-values","Thanks to a spot on the couch for consistent thinking","Conflict: mild discomfort with non-optimal protocols","Caltech Theoretical Neuroscience Group","Geek Physics Lab","Interstellar Data Commons",
